DA Miller, JA Morkel,2014-2014,2014,2014,1,0,14,14,14,0,0,South Africa,DA Miller & JA Morkel
DA Miller, M Morkel,2013-2014,2013,2014,2,1,14,13*,14,0,0,South Africa,DA Miller & M Morkel
H Davids, RE Levi,2012-2012,2012,2012,2,0,13,13,6.5,0,0,South Africa,H Davids & RE Levi
JP Duminy, D Wiese,2013-2016,2013,2016,2,1,13,7,13,0,0,South Africa,JP Duminy & D Wiese
DA Miller, K Rabada,2015-2018,2015,2018,2,0,12,8,6,0,0,South Africa,DA Miller & K Rabada
CJ Dala, DA Miller,2018-2018,2018,2018,1,0,11,11,11,0,0,South Africa,CJ Dala & DA Miller
JP Duminy, DW Steyn,2014-2014,2014,2014,1,1,11,11*,-,0,0,South Africa,JP Duminy & DW Steyn
CH Morris, JT Smuts,2017-2017,2017,2017,1,0,11,11,11,0,0,South Africa,CH Morris & JT Smuts
SM Pollock, GC Smith,2006-2006,2006,2006,1,0,11,11,11,0,0,South Africa,SM Pollock & GC Smith
GH Bodi, VD Philander,2007-2007,2007,2007,1,0,10,10,10,0,0,South Africa,GH Bodi & VD Philander
JP Duminy, CH Morris,2017-2017,2017,2017,1,0,10,10,10,0,0,South Africa,JP Duminy & CH Morris
Imran Tahir, LL Tsotsobe,2014-2014,2014,2014,1,1,10,10*,-,0,0,South Africa,Imran Tahir & LL Tsotsobe
CA Ingram, RE Levi,2012-2012,2012,2012,1,0,10,10,10,0,0,South Africa,CA Ingram & RE Levi
C Jonker, HE van der Dussen,2018-2018,2018,2018,1,0,10,10,10,0,0,South Africa,C Jonker & HE van der Dussen
JA Morkel, RJ Peterson,2012-2012,2012,2012,2,1,10,10*,10,0,0,South Africa,JA Morkel & RJ Peterson
CH Morris, AM Phangiso,2016-2016,2016,2016,1,0,10,10,10,0,0,South Africa,CH Morris & AM Phangiso
F Behardien, AL Phehlukwayo,2017-2018,2017,2018,3,1,9,7,4.5,0,0,South Africa,F Behardien & AL Phehlukwayo
CJ Dala, L Ngidi,2018-2018,2018,2018,1,0,9,9,9,0,0,South Africa,CJ Dala & L Ngidi
R McLaren, RE van der Merwe,2010-2010,2010,2010,1,1,9,9*,-,0,0,South Africa,R McLaren & RE van der Merwe
HM Amla, CA Ingram,2011-2011,2011,2011,1,0,8,8,8,0,0,South Africa,HM Amla & CA Ingram
TB de Bruyn, HG Kuhn,2017-2017,2017,2017,1,0,8,8,8,0,0,South Africa,TB de Bruyn & HG Kuhn
AB de Villiers, VD Philander,2007-2007,2007,2007,1,0,8,8,8,0,0,South Africa,AB de Villiers & VD Philander
Imran Tahir, M Morkel,2014-2014,2014,2014,1,1,8,8*,-,0,0,South Africa,Imran Tahir & M Morkel
DA Miller, AM Phangiso,2015-2015,2015,2015,1,0,8,8,8,0,0,South Africa,DA Miller & AM Phangiso
JA Morkel, M Ntini,2005-2005,2005,2005,1,0,8,8,8,0,0,South Africa,JA Morkel & M Ntini
HM Amla, GC Smith,2011-2011,2011,2011,2,0,7,5,3.5,0,0,South Africa,HM Amla & GC Smith
F Behardien, WD Parnell,2017-2017,2017,2017,2,1,7,6,7,0,0,South Africa,F Behardien & WD Parnell
J Botha, AB de Villiers,2007-2010,2007,2010,2,1,7,7*,7,0,0,South Africa,J Botha & AB de Villiers
AB de Villiers, AN Petersen,2010-2010,2010,2010,1,0,7,7,7,0,0,South Africa,AB de Villiers & AN Petersen
HH Dippenaar, GC Smith,2006-2006,2006,2006,1,0,7,7,7,0,0,South Africa,HH Dippenaar & GC Smith
JP Duminy, HG Kuhn,2010-2010,2010,2010,1,0,7,7,7,0,0,South Africa,JP Duminy & HG Kuhn
C Jonker, AL Phehlukwayo,2018-2018,2018,2018,1,0,7,7,7,0,0,South Africa,C Jonker & AL Phehlukwayo
HG Kuhn, RJ Peterson,2011-2011,2011,2011,1,0,7,7,7,0,0,South Africa,HG Kuhn & RJ Peterson
JA Morkel, AG Prince,2005-2005,2005,2005,1,0,7,7,7,0,0,South Africa,JA Morkel & AG Prince
JA Morkel, DW Steyn,2012-2012,2012,2012,1,0,7,7,7,0,0,South Africa,JA Morkel & DW Steyn
F Behardien, M Morkel,2017-2017,2017,2017,1,0,6,6,6,0,0,South Africa,F Behardien & M Morkel
F Behardien, D Wiese,2015-2015,2015,2015,1,0,6,6,6,0,0,South Africa,F Behardien & D Wiese
Q de Kock, JA Morkel,2014-2014,2014,2014,1,0,6,6,6,0,0,South Africa,Q de Kock & JA Morkel
BE Hendricks, DA Miller,2014-2014,2014,2014,1,0,6,6,6,0,0,South Africa,BE Hendricks & DA Miller
M Morkel, DW Steyn,2012-2012,2012,2012,1,0,6,6,6,0,0,South Africa,M Morkel & DW Steyn
K Rabada, D Wiese,2016-2016,2016,2016,1,1,6,6*,-,0,0,South Africa,K Rabada & D Wiese
GH Bodi, SM Pollock,2007-2007,2007,2007,1,0,5,5,5,0,0,South Africa,GH Bodi & SM Pollock
CJ Dala, T Shamsi,2018-2018,2018,2018,2,1,5,5,5,0,0,South Africa,CJ Dala & T Shamsi
JP Duminy, WD Parnell,2014-2014,2014,2014,1,0,5,5,5,0,0,South Africa,JP Duminy & WD Parnell
F du Plessis, JH Kallis,2012-2012,2012,2012,1,0,5,5,5,0,0,South Africa,F du Plessis & JH Kallis
HH Gibbs, MN van Wyk,2007-2007,2007,2007,1,0,5,5,5,0,0,South Africa,HH Gibbs & MN van Wyk
C Jonker, CH Morris,2018-2018,2018,2018,1,0,5,5,5,0,0,South Africa,C Jonker & CH Morris
GJP Kruger, JA Rudolph,2006-2006,2006,2006,1,0,5,5,5,0,0,South Africa,GJP Kruger & JA Rudolph
R McLaren, AN Petersen,2010-2010,2010,2010,1,0,5,5,5,0,0,South Africa,R McLaren & AN Petersen
M Morkel, M Ntini,2007-2007,2007,2007,1,1,5,5*,-,0,0,South Africa,M Morkel & M Ntini
KJ Abbott, WD Parnell,2014-2014,2014,2014,1,1,4,4*,-,0,0,South Africa,KJ Abbott & WD Parnell
F Behardien, Q de Kock,2012-2012,2012,2012,1,1,4,4*,-,0,0,South Africa,F Behardien & Q de Kock
MV Boucher, AG Prince,2005-2005,2005,2005,1,0,4,4,4,0,0,South Africa,MV Boucher & AG Prince
H Klaasen, AL Phehlukwayo,2018-2018,2018,2018,1,0,4,4,4,0,0,South Africa,H Klaasen & AL Phehlukwayo
CK Langeveldt, JA Morkel,2005-2005,2005,2005,1,0,4,4,4,0,0,South Africa,CK Langeveldt & JA Morkel
R McLaren, DA Miller,2010-2010,2010,2010,1,0,4,4,4,0,0,South Africa,R McLaren & DA Miller
DA Miller, MN van Wyk,2011-2011,2011,2011,1,0,4,4,4,0,0,South Africa,DA Miller & MN van Wyk
M Morkel, D Paterson,2017-2017,2017,2017,1,1,4,4*,-,0,0,South Africa,M Morkel & D Paterson
CH Morris, WD Parnell,2017-2017,2017,2017,1,1,4,4*,-,0,0,South Africa,CH Morris & WD Parnell
A Nel, M Ntini,2005-2005,2005,2005,1,0,4,4,4,0,0,South Africa,A Nel & M Ntini
L Ngidi, AM Phangiso,2017-2017,2017,2017,1,0,4,4,4,0,0,South Africa,L Ngidi & AM Phangiso
KJ Abbott, F Behardien,2015-2015,2015,2015,1,0,3,3,3,0,0,South Africa,KJ Abbott & F Behardien
J Botha, JA Rudolph,2006-2006,2006,2006,1,0,3,3,3,0,0,South Africa,J Botha & JA Rudolph
J Botha, J Theron,2011-2011,2011,2011,1,0,3,3,3,0,0,South Africa,J Botha & J Theron
J Botha, LL Tsotsobe,2009-2009,2009,2009,1,0,3,3,3,0,0,South Africa,J Botha & LL Tsotsobe
MV Boucher, RE van der Merwe,2009-2009,2009,2009,1,0,3,3,3,0,0,South Africa,MV Boucher & RE van der Merwe
GL Cloete, Q de Kock,2018-2018,2018,2018,1,0,3,3,3,0,0,South Africa,GL Cloete & Q de Kock
F du Plessis, MN van Wyk,2015-2015,2015,2015,1,0,3,3,3,0,0,South Africa,F du Plessis & MN van Wyk
T Henderson, R Telemachus,2006-2006,2006,2006,1,0,3,3,3,0,0,South Africa,T Henderson & R Telemachus
JM Kemp, GC Smith,2006-2006,2006,2006,1,0,3,3,3,0,0,South Africa,JM Kemp & GC Smith
RK Kleinveldt, J Louw,2008-2008,2008,2008,1,1,3,3*,-,0,0,South Africa,RK Kleinveldt & J Louw
HG Kuhn, R McLaren,2009-2009,2009,2009,1,1,3,3*,-,0,0,South Africa,HG Kuhn & R McLaren
CK Langeveldt, M Morkel,2010-2010,2010,2010,1,0,3,3,3,0,0,South Africa,CK Langeveldt & M Morkel
CK Langeveldt, R Telemachus,2006-2006,2006,2006,1,1,3,3*,-,0,0,South Africa,CK Langeveldt & R Telemachus
M Ntini, J Theron,2011-2011,2011,2011,1,1,3,3*,-,0,0,South Africa,M Ntini & J Theron
KJ Abbott, LL Tsotsobe,2013-2013,2013,2013,1,0,2,2,2,0,0,South Africa,KJ Abbott & LL Tsotsobe
HM Amla, JL Ontong,2012-2012,2012,2012,1,0,2,2,2,0,0,South Africa,HM Amla & JL Ontong
GH Bodi, JA Morkel,2007-2007,2007,2007,1,0,2,2,2,0,0,South Africa,GH Bodi & JA Morkel
J Botha, RK Kleinveldt,2008-2008,2008,2008,1,0,2,2,2,0,0,South Africa,J Botha & RK Kleinveldt
J Botha, HG Kuhn,2011-2011,2011,2011,1,0,2,2,2,0,0,South Africa,J Botha & HG Kuhn
J Botha, M Ntini,2009-2009,2009,2009,1,0,2,2,2,0,0,South Africa,J Botha & M Ntini
MV Boucher, VB van Jaarsveld,2009-2009,2009,2009,1,0,2,2,2,0,0,South Africa,MV Boucher & VB van Jaarsveld
AB de Villiers, RK Kleinveldt,2008-2008,2008,2008,1,0,2,2,2,0,0,South Africa,AB de Villiers & RK Kleinveldt
AB de Villiers, M Mosehle,2017-2017,2017,2017,1,0,2,2,2,0,0,South Africa,AB de Villiers & M Mosehle
AB de Villiers, RJ Peterson,2009-2009,2009,2009,1,0,2,2,2,0,0,South Africa,AB de Villiers & RJ Peterson
JP Duminy, R McLaren,2014-2014,2014,2014,1,0,2,2,2,0,0,South Africa,JP Duminy & R McLaren
Imran Tahir, DA Miller,2014-2014,2014,2014,1,0,2,2,2,0,0,South Africa,Imran Tahir & DA Miller
Imran Tahir, AM Phangiso,2017-2017,2017,2017,1,0,2,2,2,0,0,South Africa,Imran Tahir & AM Phangiso
HG Kuhn, WD Parnell,2011-2011,2011,2011,1,0,2,2,2,0,0,South Africa,HG Kuhn & WD Parnell
DA Miller, AN Petersen,2010-2010,2010,2010,1,0,2,2,2,0,0,South Africa,DA Miller & AN Petersen
M Morkel, JJ van der Wath,2007-2007,2007,2007,1,0,2,2,2,0,0,South Africa,M Morkel & JJ van der Wath
DW Steyn, RE van der Merwe,2010-2010,2010,2010,1,1,2,2*,-,0,0,South Africa,DW Steyn & RE van der Merwe
LE Bosman, AB de Villiers,2009-2009,2009,2009,1,0,1,1,1,0,0,South Africa,LE Bosman & AB de Villiers
J Botha, M Morkel,2010-2010,2010,2010,1,0,1,1,1,0,0,South Africa,J Botha & M Morkel
J Botha, JL Ontong,2012-2012,2012,2012,1,0,1,1,1,0,0,South Africa,J Botha & JL Ontong
HG Kuhn, J Theron,2011-2011,2011,2011,1,1,1,1*,-,0,0,South Africa,HG Kuhn & J Theron
D Paterson, AL Phehlukwayo,2018-2018,2018,2018,1,0,1,1,1,0,0,South Africa,D Paterson & AL Phehlukwayo
KJ Abbott, RJ Peterson,2013-2013,2013,2013,1,0,0,0,0,0,0,South Africa,KJ Abbott & RJ Peterson
F Behardien, RK Kleinveldt,2012-2012,2012,2012,1,0,0,0,0,0,0,South Africa,F Behardien & RK Kleinveldt
GH Bodi, HH Gibbs,2007-2007,2007,2007,1,0,0,0,0,0,0,South Africa,GH Bodi & HH Gibbs
AB de Villiers, CH Morris,2013-2013,2013,2013,1,0,0,0,0,0,0,South Africa,AB de Villiers & CH Morris
JP Duminy, HH Gibbs,2007-2007,2007,2007,1,0,0,0,0,0,0,South Africa,JP Duminy & HH Gibbs
T Henderson, JJ van der Wath,2006-2006,2006,2006,1,0,0,0,0,0,0,South Africa,T Henderson & JJ van der Wath
JH Kallis, JA Rudolph,2006-2006,2006,2006,1,0,0,0,0,0,0,South Africa,JH Kallis & JA Rudolph
DA Miller, AL Phehlukwayo,2018-2018,2018,2018,1,0,0,0,0,0,0,South Africa,DA Miller & AL Phehlukwayo
CH Morris, AL Phehlukwayo,2018-2018,2018,2018,1,0,0,0,0,0,0,South Africa,CH Morris & AL Phehlukwayo
JA Rudolph, M Zondeki,2006-2006,2006,2006,1,0,0,0,0,0,0,South Africa,JA Rudolph & M Zondeki
GC Smith, RE van der Merwe,2009-2009,2009,2009,1,0,0,0,0,0,0,South Africa,GC Smith & RE van der Merwe
DPMD Jayawardene, KC Sangakkara,2007-2014,2007,2014,22,2,822,166,41.1,2,3,Sri Lanka,DPMD Jayawardene & KC Sangakkara
TM Dilshan, DPMD Jayawardene,2007-2014,2007,2014,31,2,766,145,26.41,1,3,Sri Lanka,TM Dilshan & DPMD Jayawardene
TM Dilshan, KC Sangakkara,2006-2014,2006,2014,22,1,626,74,29.8,0,5,Sri Lanka,TM Dilshan & KC Sangakkara
TM Dilshan, MDKJ Perera,2013-2016,2013,2016,22,0,606,100,27.54,1,2,Sri Lanka,TM Dilshan & MDKJ Perera
TM Dilshan, ST Jayasuriya,2006-2010,2006,2010,15,0,455,124,30.33,1,3,Sri Lanka,TM Dilshan & ST Jayasuriya
LD Chandimal, TM Dilshan,2010-2016,2010,2016,17,0,430,110,25.29,1,1,Sri Lanka,LD Chandimal & TM Dilshan
ST Jayasuriya, DPMD Jayawardene,2006-2011,2006,2011,14,1,321,87,24.69,0,3,Sri Lanka,ST Jayasuriya & DPMD Jayawardene
MD Gunathilaka, BKG Mendis,2016-2018,2016,2018,7,0,300,98,42.85,0,3,Sri Lanka,MD Gunathilaka & BKG Mendis
MDKJ Perera, WU Tharanga,2017-2018,2017,2018,7,0,297,109,42.42,1,2,Sri Lanka,MDKJ Perera & WU Tharanga
AD Mathews, NLTC Perera,2010-2016,2010,2016,13,4,292,44,32.44,0,0,Sri Lanka,AD Mathews & NLTC Perera
AD Mathews, KC Sangakkara,2009-2014,2009,2014,11,1,255,68*,25.5,0,2,Sri Lanka,AD Mathews & KC Sangakkara
CK Kapugedera, AD Mathews,2009-2016,2009,2016,8,0,245,80,30.62,0,2,Sri Lanka,CK Kapugedera & AD Mathews
AD Mathews, HDRL Thirimanne,2012-2016,2012,2016,10,0,235,58,23.5,0,1,Sri Lanka,AD Mathews & HDRL Thirimanne
ST Jayasuriya, KC Sangakkara,2007-2010,2007,2010,7,0,227,81,32.42,0,2,Sri Lanka,ST Jayasuriya & KC Sangakkara
ST Jayasuriya, WU Tharanga,2006-2007,2006,2007,7,0,218,82,31.14,0,2,Sri Lanka,ST Jayasuriya & WU Tharanga
KMDN Kulasekara, NLTC Perera,2012-2016,2012,2016,8,2,210,44,35,0,0,Sri Lanka,KMDN Kulasekara & NLTC Perera
LD Chandimal, MDKJ Perera,2013-2018,2013,2018,7,0,204,54,29.14,0,1,Sri Lanka,LD Chandimal & MDKJ Perera
LD Chandimal, AD Mathews,2010-2018,2010,2018,9,1,195,60*,24.37,0,2,Sri Lanka,LD Chandimal & AD Mathews
LD Chandimal, CK Kapugedera,2010-2016,2010,2016,5,0,182,52,36.4,0,1,Sri Lanka,LD Chandimal & CK Kapugedera
TM Dilshan, AD Mathews,2009-2016,2009,2016,8,3,175,42*,35,0,0,Sri Lanka,TM Dilshan & AD Mathews
CK Kapugedera, TAM Siriwardana,2015-2017,2015,2017,8,0,167,55,20.87,0,1,Sri Lanka,CK Kapugedera & TAM Siriwardana
MDKJ Perera, KC Sangakkara,2013-2014,2013,2014,4,0,156,78,39,0,1,Sri Lanka,MDKJ Perera & KC Sangakkara
NLTC Perera, MD Shanaka,2016-2018,2016,2018,6,2,156,65*,39,0,1,Sri Lanka,NLTC Perera & MD Shanaka
TM Dilshan, BMAJ Mendis,2011-2012,2011,2012,3,1,149,104*,74.5,1,0,Sri Lanka,TM Dilshan & BMAJ Mendis
TM Dilshan, LPC Silva,2006-2009,2006,2009,5,0,147,50,29.4,0,1,Sri Lanka,TM Dilshan & LPC Silva
AD Mathews, BMAJ Mendis,2012-2013,2012,2013,3,0,146,66,48.66,0,2,Sri Lanka,AD Mathews & BMAJ Mendis
DM de Silva, N Dickwella,2017-2017,2017,2017,3,0,141,71,47,0,2,Sri Lanka,DM de Silva & N Dickwella
NLTC Perera, KC Sangakkara,2010-2014,2010,2014,6,2,140,56*,35,0,1,Sri Lanka,NLTC Perera & KC Sangakkara
DPMD Jayawardene, LPC Silva,2007-2009,2007,2009,6,1,135,53,27,0,1,Sri Lanka,DPMD Jayawardene & LPC Silva
N Dickwella, WU Tharanga,2017-2017,2017,2017,7,0,128,36,18.28,0,0,Sri Lanka,N Dickwella & WU Tharanga
DPMD Jayawardene, NLTC Perera,2010-2014,2010,2014,4,1,128,59*,42.66,0,2,Sri Lanka,DPMD Jayawardene & NLTC Perera
LD Chandimal, DPMD Jayawardene,2010-2013,2010,2013,4,0,127,59,31.75,0,1,Sri Lanka,LD Chandimal & DPMD Jayawardene
LD Chandimal, DM de Silva,2016-2018,2016,2018,4,0,123,53,30.75,0,1,Sri Lanka,LD Chandimal & DM de Silva
TM Dilshan, CK Kapugedera,2008-2016,2008,2016,8,1,123,28,17.57,0,0,Sri Lanka,TM Dilshan & CK Kapugedera
TM Dilshan, GSNFG Jayasuriya,2015-2016,2015,2016,6,0,121,70,20.16,0,1,Sri Lanka,TM Dilshan & GSNFG Jayasuriya
TM Dilshan, NLTC Perera,2010-2016,2010,2016,4,1,119,44,39.66,0,0,Sri Lanka,TM Dilshan & NLTC Perera
CK Kapugedera, KC Sangakkara,2006-2009,2006,2009,4,0,115,69,28.75,0,1,Sri Lanka,CK Kapugedera & KC Sangakkara
N Dickwella, EMDY Munaweera,2017-2017,2017,2017,3,0,114,74,38,0,1,Sri Lanka,N Dickwella & EMDY Munaweera
ST Jayasuriya, ML Udawatte,2008-2009,2008,2009,4,0,113,66,28.25,0,1,Sri Lanka,ST Jayasuriya & ML Udawatte
MDKJ Perera, NLTC Perera,2017-2018,2017,2018,3,0,111,97,37,0,1,Sri Lanka,MDKJ Perera & NLTC Perera
LD Chandimal, GSNFG Jayasuriya,2015-2016,2015,2016,2,0,110,56,55,0,2,Sri Lanka,LD Chandimal & GSNFG Jayasuriya
BKG Mendis, WU Tharanga,2018-2018,2018,2018,3,0,110,62,36.66,0,1,Sri Lanka,BKG Mendis & WU Tharanga
BKG Mendis, MDKJ Perera,2018-2018,2018,2018,4,0,105,85,26.25,0,1,Sri Lanka,BKG Mendis & MDKJ Perera
MD Gunathilaka, S Samarawickrama,2017-2017,2017,2017,3,0,96,63,32,0,1,Sri Lanka,MD Gunathilaka & S Samarawickrama
TM Dilshan, J Mubarak,2007-2009,2007,2009,6,1,94,51*,18.8,0,1,Sri Lanka,TM Dilshan & J Mubarak
BMAJ Mendis, KC Sangakkara,2012-2013,2012,2013,2,0,94,94,47,0,1,Sri Lanka,BMAJ Mendis & KC Sangakkara
DPMD Jayawardene, CK Kapugedera,2006-2010,2006,2010,4,0,91,28,22.75,0,0,Sri Lanka,DPMD Jayawardene & CK Kapugedera
NLTC Perera, SMSM Senanayake,2013-2016,2013,2016,5,3,84,27*,42,0,0,Sri Lanka,NLTC Perera & SMSM Senanayake
DPMD Jayawardene, J Mubarak,2008-2009,2008,2009,5,0,81,30,16.2,0,0,Sri Lanka,DPMD Jayawardene & J Mubarak
KMDN Kulasekara, AD Mathews,2009-2017,2009,2017,6,2,78,39*,19.5,0,0,Sri Lanka,KMDN Kulasekara & AD Mathews
DAS Gunaratne, TAM Siriwardana,2016-2017,2016,2017,4,0,75,60,18.75,0,1,Sri Lanka,DAS Gunaratne & TAM Siriwardana
MD Gunathilaka, MDKJ Perera,2016-2018,2016,2018,2,0,75,58,37.5,0,1,Sri Lanka,MD Gunathilaka & MDKJ Perera
DPMD Jayawardene, BMAJ Mendis,2011-2013,2011,2013,3,0,74,63,24.66,0,1,Sri Lanka,DPMD Jayawardene & BMAJ Mendis
KC Sangakkara, LPC Silva,2007-2009,2007,2009,3,0,74,35,24.66,0,0,Sri Lanka,KC Sangakkara & LPC Silva
DPMD Jayawardene, AD Mathews,2009-2014,2009,2014,7,1,73,25,12.16,0,0,Sri Lanka,DPMD Jayawardene & AD Mathews
AD Mathews, MDKJ Perera,2013-2017,2013,2017,4,0,73,29,18.25,0,0,Sri Lanka,AD Mathews & MDKJ Perera
LD Chandimal, KC Sangakkara,2011-2014,2011,2014,4,0,71,26,17.75,0,0,Sri Lanka,LD Chandimal & KC Sangakkara
CK Kapugedera, NLTC Perera,2010-2017,2010,2017,5,1,70,58,17.5,0,1,Sri Lanka,CK Kapugedera & NLTC Perera
MDKJ Perera, S Prasanna,2013-2017,2013,2017,3,0,70,33,23.33,0,0,Sri Lanka,MDKJ Perera & S Prasanna
BKG Mendis, NLTC Perera,2018-2018,2018,2018,2,0,68,51,34,0,1,Sri Lanka,BKG Mendis & NLTC Perera
KC Sangakkara, HDRL Thirimanne,2013-2014,2013,2014,3,0,68,37,22.66,0,0,Sri Lanka,KC Sangakkara & HDRL Thirimanne
NLTC Perera, HDRL Thirimanne,2012-2014,2012,2014,5,1,61,36,15.25,0,0,Sri Lanka,NLTC Perera & HDRL Thirimanne
TM Dilshan, EMDY Munaweera,2012-2012,2012,2012,2,1,60,54,60,0,1,Sri Lanka,TM Dilshan & EMDY Munaweera
TM Dilshan, HDRL Thirimanne,2014-2016,2014,2016,3,0,59,42,19.66,0,0,Sri Lanka,TM Dilshan & HDRL Thirimanne
AD Mathews, S Prasanna,2014-2017,2014,2017,3,0,57,39,19,0,0,Sri Lanka,AD Mathews & S Prasanna
EMDY Munaweera, WU Tharanga,2017-2017,2017,2017,2,0,56,41,28,0,0,Sri Lanka,EMDY Munaweera & WU Tharanga
MD Shanaka, TAM Siriwardana,2016-2017,2016,2017,4,0,56,48,14,0,0,Sri Lanka,MD Shanaka & TAM Siriwardana
MD Shanaka, WU Tharanga,2018-2018,2018,2018,3,0,56,45,18.66,0,0,Sri Lanka,MD Shanaka & WU Tharanga
TM Dilshan, TAM Siriwardana,2016-2016,2016,2016,2,1,55,30,55,0,0,Sri Lanka,TM Dilshan & TAM Siriwardana
DAS Gunaratne, S Prasanna,2017-2017,2017,2017,2,1,55,28*,55,0,0,Sri Lanka,DAS Gunaratne & S Prasanna
MD Gunathilaka, EMDY Munaweera,2017-2017,2017,2017,3,0,54,43,18,0,0,Sri Lanka,MD Gunathilaka & EMDY Munaweera
HDRL Thirimanne, KDK Vithanage,2014-2014,2014,2014,1,0,54,54,54,0,1,Sri Lanka,HDRL Thirimanne & KDK Vithanage
CRD Fernando, SL Malinga,2006-2007,2006,2007,3,0,53,44,17.66,0,0,Sri Lanka,CRD Fernando & SL Malinga
DAS Gunaratne, CK Kapugedera,2017-2017,2017,2017,2,0,52,52,26,0,1,Sri Lanka,DAS Gunaratne & CK Kapugedera
DAS Gunaratne, MDKJ Perera,2017-2017,2017,2017,3,0,51,41,17,0,0,Sri Lanka,DAS Gunaratne & MDKJ Perera
DPMD Jayawardene, HDRL Thirimanne,2012-2014,2012,2014,2,0,51,30,25.5,0,0,Sri Lanka,DPMD Jayawardene & HDRL Thirimanne
J Mubarak, ML Udawatte,2008-2008,2008,2008,1,0,51,51,51,0,1,Sri Lanka,J Mubarak & ML Udawatte
A Dananjaya, MD Shanaka,2017-2018,2017,2018,2,1,50,26,50,0,0,Sri Lanka,A Dananjaya & MD Shanaka
DM de Silva, AD Mathews,2015-2017,2015,2017,2,0,50,36,25,0,0,Sri Lanka,DM de Silva & AD Mathews
EMDY Munaweera, MDKJ Perera,2013-2017,2013,2017,3,0,50,32,16.66,0,0,Sri Lanka,EMDY Munaweera & MDKJ Perera
NLTC Perera, TAM Siriwardana,2016-2016,2016,2016,2,0,50,49,25,0,0,Sri Lanka,NLTC Perera & TAM Siriwardana
LD Chandimal, MD Gunathilaka,2016-2016,2016,2016,3,0,49,19,16.33,0,0,Sri Lanka,LD Chandimal & MD Gunathilaka
CK Kapugedera, MF Maharoof,2006-2008,2006,2008,2,1,49,30*,49,0,0,Sri Lanka,CK Kapugedera & MF Maharoof
RJMGM Rupasinghe, KC Sangakkara,2009-2009,2009,2009,1,0,49,49,49,0,0,Sri Lanka,RJMGM Rupasinghe & KC Sangakkara
DPMD Jayawardene, MDKJ Perera,2013-2014,2013,2014,4,0,46,25,11.5,0,0,Sri Lanka,DPMD Jayawardene & MDKJ Perera
J Mubarak, KC Sangakkara,2007-2009,2007,2009,2,1,46,33*,46,0,0,Sri Lanka,J Mubarak & KC Sangakkara
CK Kapugedera, MD Shanaka,2015-2016,2015,2016,3,0,45,27,15,0,0,Sri Lanka,CK Kapugedera & MD Shanaka
J Mubarak, G Wijekoon,2007-2007,2007,2007,1,1,45,45*,-,0,0,Sri Lanka,J Mubarak & G Wijekoon
DAS Gunaratne, S Samarawickrama,2017-2017,2017,2017,2,0,43,38,21.5,0,0,Sri Lanka,DAS Gunaratne & S Samarawickrama
AD Mathews, JDF Vandersay,2016-2016,2016,2016,2,2,43,39*,-,0,0,Sri Lanka,AD Mathews & JDF Vandersay
S Prasanna, TAM Siriwardana,2016-2017,2016,2017,2,1,43,29,43,0,0,Sri Lanka,S Prasanna & TAM Siriwardana
MD Gunathilaka, TAM Siriwardana,2016-2016,2016,2016,1,0,42,42,42,0,0,Sri Lanka,MD Gunathilaka & TAM Siriwardana
DM de Silva, MDKJ Perera,2016-2016,2016,2016,2,0,41,35,20.5,0,0,Sri Lanka,DM de Silva & MDKJ Perera
TM Dilshan, HGJM Kulatunga,2008-2008,2008,2008,2,0,41,28,20.5,0,0,Sri Lanka,TM Dilshan & HGJM Kulatunga
DAS Gunaratne, KMDN Kulasekara,2017-2017,2017,2017,1,0,41,41,41,0,0,Sri Lanka,DAS Gunaratne & KMDN Kulasekara
CK Kapugedera, S Prasanna,2017-2017,2017,2017,2,1,41,21,41,0,0,Sri Lanka,CK Kapugedera & S Prasanna
J Mubarak, WPUJC Vaas,2007-2007,2007,2007,1,0,40,40,40,0,0,Sri Lanka,J Mubarak & WPUJC Vaas
KC Sangakkara, WU Tharanga,2007-2007,2007,2007,2,0,40,32,20,0,0,Sri Lanka,KC Sangakkara & WU Tharanga
PC de Silva, MD Shanaka,2017-2017,2017,2017,1,0,39,39,39,0,0,Sri Lanka,PC de Silva & MD Shanaka
LD Chandimal, N Dickwella,2017-2018,2017,2018,3,0,38,20,12.66,0,0,Sri Lanka,LD Chandimal & N Dickwella
SL Malinga, NLTC Perera,2011-2018,2011,2018,2,0,38,37,19,0,0,Sri Lanka,SL Malinga & NLTC Perera
NLTC Perera, S Prasanna,2017-2017,2017,2017,4,1,38,17,12.66,0,0,Sri Lanka,NLTC Perera & S Prasanna
DM de Silva, TAM Siriwardana,2015-2015,2015,2015,1,0,37,37,37,0,0,Sri Lanka,DM de Silva & TAM Siriwardana
N Dickwella, MD Shanaka,2018-2018,2018,2018,1,0,37,37,37,0,0,Sri Lanka,N Dickwella & MD Shanaka
AD Mathews, MD Shanaka,2016-2016,2016,2016,3,0,37,18,12.33,0,0,Sri Lanka,AD Mathews & MD Shanaka
EMDY Munaweera, SMA Priyanjan,2017-2017,2017,2017,1,0,37,37,37,0,0,Sri Lanka,EMDY Munaweera & SMA Priyanjan
TM Dilshan, ML Udawatte,2008-2008,2008,2008,1,0,36,36,36,0,0,Sri Lanka,TM Dilshan & ML Udawatte
SMA Priyanjan, I Udana,2017-2017,2017,2017,1,1,36,36*,-,0,0,Sri Lanka,SMA Priyanjan & I Udana
MD Shanaka, ML Udawatte,2017-2017,2017,2017,2,0,36,36,18,0,0,Sri Lanka,MD Shanaka & ML Udawatte
LD Chandimal, MD Shanaka,2016-2018,2016,2018,4,1,35,19,11.66,0,0,Sri Lanka,LD Chandimal & MD Shanaka
TM Dilshan, WPUJC Vaas,2007-2007,2007,2007,1,0,35,35,35,0,0,Sri Lanka,TM Dilshan & WPUJC Vaas
CK Kapugedera, KMDN Kulasekara,2016-2017,2016,2017,4,0,35,20,8.75,0,0,Sri Lanka,CK Kapugedera & KMDN Kulasekara
LD Chandimal, TAM Siriwardana,2016-2016,2016,2016,4,0,34,22,8.5,0,0,Sri Lanka,LD Chandimal & TAM Siriwardana
LD Chandimal, BKG Mendis,2016-2018,2016,2018,2,0,33,31,16.5,0,0,Sri Lanka,LD Chandimal & BKG Mendis
LD Chandimal, HDRL Thirimanne,2012-2016,2012,2016,3,0,33,14,11,0,0,Sri Lanka,LD Chandimal & HDRL Thirimanne
CK Kapugedera, J Mubarak,2008-2008,2008,2008,2,0,33,21,16.5,0,0,Sri Lanka,CK Kapugedera & J Mubarak
CK Kapugedera, K Weeraratne,2008-2008,2008,2008,2,0,33,21,16.5,0,0,Sri Lanka,CK Kapugedera & K Weeraratne
CK Kapugedera, SMSM Senanayake,2016-2016,2016,2016,1,0,32,32,32,0,0,Sri Lanka,CK Kapugedera & SMSM Senanayake
KMDN Kulasekara, SL Malinga,2009-2017,2009,2017,5,0,32,27,6.4,0,0,Sri Lanka,KMDN Kulasekara & SL Malinga
BKG Mendis, EMDY Munaweera,2017-2017,2017,2017,2,0,32,27,16,0,0,Sri Lanka,BKG Mendis & EMDY Munaweera
DM de Silva, S Prasanna,2016-2017,2016,2017,2,0,30,28,15,0,0,Sri Lanka,DM de Silva & S Prasanna
TM Dilshan, WU Tharanga,2011-2011,2011,2011,1,0,30,30,30,0,0,Sri Lanka,TM Dilshan & WU Tharanga
CU Jayasinghe, KC Sangakkara,2009-2009,2009,2009,1,0,30,30,30,0,0,Sri Lanka,CU Jayasinghe & KC Sangakkara
SS Pathirana, S Prasanna,2017-2017,2017,2017,2,0,30,28,15,0,0,Sri Lanka,SS Pathirana & S Prasanna
DM de Silva, GSNFG Jayasuriya,2015-2015,2015,2015,1,0,29,29,29,0,0,Sri Lanka,DM de Silva & GSNFG Jayasuriya
DM de Silva, PHKD Mendis,2018-2018,2018,2018,1,0,28,28,28,0,0,Sri Lanka,DM de Silva & PHKD Mendis
ST Jayasuriya, J Mubarak,2008-2009,2008,2009,2,0,28,26,14,0,0,Sri Lanka,ST Jayasuriya & J Mubarak
SHT Kandamby, CK Kapugedera,2008-2008,2008,2008,1,0,28,28,28,0,0,Sri Lanka,SHT Kandamby & CK Kapugedera
LHD Dilhara, TM Dilshan,2008-2008,2008,2008,1,0,27,27,27,0,0,Sri Lanka,LHD Dilhara & TM Dilshan
S Prasanna, MD Shanaka,2016-2016,2016,2016,1,0,27,27,27,0,0,Sri Lanka,S Prasanna & MD Shanaka
LD Chandimal, NLTC Perera,2011-2018,2011,2018,4,0,26,18,6.5,0,0,Sri Lanka,LD Chandimal & NLTC Perera
DAS Gunaratne, EMDY Munaweera,2017-2017,2017,2017,3,0,26,13,8.66,0,0,Sri Lanka,DAS Gunaratne & EMDY Munaweera
DAS Gunaratne, MD Shanaka,2017-2017,2017,2017,1,0,26,26,26,0,0,Sri Lanka,DAS Gunaratne & MD Shanaka
GSNFG Jayasuriya, TAM Siriwardana,2015-2015,2015,2015,1,0,26,26,26,0,0,Sri Lanka,GSNFG Jayasuriya & TAM Siriwardana
LD Chandimal, DAS Gunaratne,2016-2017,2016,2017,2,1,25,16*,25,0,0,Sri Lanka,LD Chandimal & DAS Gunaratne
B Fernando, CK Kapugedera,2015-2015,2015,2015,1,1,25,25*,-,0,0,Sri Lanka,B Fernando & CK Kapugedera
AD Mathews, TAM Siriwardana,2015-2016,2015,2016,4,0,25,15,6.25,0,0,Sri Lanka,AD Mathews & TAM Siriwardana
NLTC Perera, I Udana,2018-2018,2018,2018,2,0,25,16,12.5,0,0,Sri Lanka,NLTC Perera & I Udana
LD Chandimal, RLB Rambukwella,2016-2016,2016,2016,1,0,24,24,24,0,0,Sri Lanka,LD Chandimal & RLB Rambukwella
KS Lokuarachchi, HDRL Thirimanne,2012-2012,2012,2012,1,0,24,24,24,0,0,Sri Lanka,KS Lokuarachchi & HDRL Thirimanne
AD Mathews, RJMGM Rupasinghe,2009-2009,2009,2009,1,0,24,24,24,0,0,Sri Lanka,AD Mathews & RJMGM Rupasinghe
BKG Mendis, S Prasanna,2017-2017,2017,2017,1,0,24,24,24,0,0,Sri Lanka,BKG Mendis & S Prasanna
TM Dilshan, MD Gunathilaka,2016-2016,2016,2016,3,0,23,11,7.66,0,0,Sri Lanka,TM Dilshan & MD Gunathilaka
DPMD Jayawardene, HGJM Kulatunga,2008-2008,2008,2008,1,0,22,22,22,0,0,Sri Lanka,DPMD Jayawardene & HGJM Kulatunga
EMDY Munaweera, KC Sangakkara,2012-2012,2012,2012,1,0,22,22,22,0,0,Sri Lanka,EMDY Munaweera & KC Sangakkara
SMA Priyanjan, S Samarawickrama,2017-2017,2017,2017,1,0,22,22,22,0,0,Sri Lanka,SMA Priyanjan & S Samarawickrama
CK Kapugedera, WU Tharanga,2006-2017,2006,2017,2,0,21,21,10.5,0,0,Sri Lanka,CK Kapugedera & WU Tharanga
SL Malinga, WPUJC Vaas,2007-2007,2007,2007,2,0,21,16,10.5,0,0,Sri Lanka,SL Malinga & WPUJC Vaas
S Prasanna, SMA Priyanjan,2017-2017,2017,2017,1,0,21,21,21,0,0,Sri Lanka,S Prasanna & SMA Priyanjan
LHD Dilhara, KMDN Kulasekara,2008-2008,2008,2008,1,1,20,20*,-,0,0,Sri Lanka,LHD Dilhara & KMDN Kulasekara
