Ahsan Malik, MP O'Dowd,2017-2017,2017,2017,1,0,1,1,1,0,0,Netherlands,Ahsan Malik & MP O'Dowd
W Barresi, BFW de Leede,2018-2018,2018,2018,1,1,1,1*,-,0,0,Netherlands,W Barresi & BFW de Leede
W Barresi, T van der Gugten,2018-2018,2018,2018,1,0,1,1,1,0,0,Netherlands,W Barresi & T van der Gugten
BN Cooper, TP Visee,2018-2018,2018,2018,1,0,1,1,1,0,0,Netherlands,BN Cooper & TP Visee
BFW de Leede, Sikander Zulfiqar,2018-2018,2018,2018,1,0,1,1,1,0,0,Netherlands,BFW de Leede & Sikander Zulfiqar
SA Edwards, FJ Klaassen,2018-2018,2018,2018,2,0,1,1,0.5,0,0,Netherlands,SA Edwards & FJ Klaassen
MBS Jonkman, PM Seelaar,2010-2010,2010,2010,1,0,1,1,1,0,0,Netherlands,MBS Jonkman & PM Seelaar
MJG Rippon, TP Visee,2017-2017,2017,2017,1,0,1,1,1,0,0,Netherlands,MJG Rippon & TP Visee
PM Seelaar, PA van Meekeren,2013-2013,2013,2013,1,0,1,1,1,0,0,Netherlands,PM Seelaar & PA van Meekeren
Sikander Zulfiqar, PA van Meekeren,2016-2016,2016,2016,1,0,1,1,1,0,0,Netherlands,Sikander Zulfiqar & PA van Meekeren
T van der Gugten, PA van Meekeren,2017-2017,2017,2017,1,0,1,1,1,0,0,Netherlands,T van der Gugten & PA van Meekeren
W Barresi, TN de Grooth,2013-2013,2013,2013,1,0,0,0,0,0,0,Netherlands,W Barresi & TN de Grooth
PW Borren, HJC Mol,2008-2008,2008,2008,1,0,0,0,0,0,0,Netherlands,PW Borren & HJC Mol
BFW de Leede, Saqib Zulfiqar,2018-2018,2018,2018,1,0,0,0,0,0,0,Netherlands,BFW de Leede & Saqib Zulfiqar
MBS Jonkman, Mohammad Kashif,2010-2010,2010,2010,1,0,0,0,0,0,0,Netherlands,MBS Jonkman & Mohammad Kashif
MP O'Dowd, MJG Rippon,2016-2016,2016,2016,1,0,0,0,0,0,0,Netherlands,MP O'Dowd & MJG Rippon
MJ Guptill, KS Williamson,2012-2018,2012,2018,24,1,1151,171*,50.04,3,8,New Zealand,MJ Guptill & KS Williamson
MJ Guptill, BB McCullum,2009-2015,2009,2015,22,2,831,127*,41.55,2,4,New Zealand,MJ Guptill & BB McCullum
MJ Guptill, C Munro,2012-2018,2012,2018,17,1,670,136,41.87,3,1,New Zealand,MJ Guptill & C Munro
BB McCullum, LRPL Taylor,2006-2014,2006,2014,22,0,559,78,25.4,0,4,New Zealand,BB McCullum & LRPL Taylor
BB McCullum, JD Ryder,2008-2014,2008,2014,17,0,550,130,32.35,1,3,New Zealand,BB McCullum & JD Ryder
C Munro, KS Williamson,2015-2018,2015,2018,21,1,537,80,26.85,0,4,New Zealand,C Munro & KS Williamson
MJ Guptill, RJ Nicol,2012-2012,2012,2012,12,0,385,76,32.08,0,3,New Zealand,MJ Guptill & RJ Nicol
BB McCullum, KS Williamson,2012-2015,2012,2015,10,1,309,90,34.33,0,2,New Zealand,BB McCullum & KS Williamson
TC Bruce, C Munro,2017-2018,2017,2018,4,1,283,123,94.33,1,2,New Zealand,TC Bruce & C Munro
C Munro, LRPL Taylor,2013-2018,2013,2018,8,2,277,93,46.16,0,1,New Zealand,C Munro & LRPL Taylor
MJ Guptill, JD Ryder,2009-2014,2009,2014,10,0,252,62,25.2,0,2,New Zealand,MJ Guptill & JD Ryder
CJ Anderson, KS Williamson,2016-2018,2016,2018,6,0,239,124,39.83,1,0,New Zealand,CJ Anderson & KS Williamson
SB Styris, LRPL Taylor,2007-2010,2007,2010,11,1,223,62,22.3,0,1,New Zealand,SB Styris & LRPL Taylor
JDP Oram, LRPL Taylor,2007-2012,2007,2012,9,1,220,51,27.5,0,1,New Zealand,JDP Oram & LRPL Taylor
BB McCullum, L Vincent,2007-2007,2007,2007,8,0,212,68,26.5,0,2,New Zealand,BB McCullum & L Vincent
MJ Guptill, LRPL Taylor,2009-2014,2009,2014,10,0,211,53,21.1,0,1,New Zealand,MJ Guptill & LRPL Taylor
LRPL Taylor, KS Williamson,2012-2018,2012,2018,9,0,208,51,23.11,0,1,New Zealand,LRPL Taylor & KS Williamson
C Munro, GD Phillips,2017-2018,2017,2018,6,0,195,86,32.5,0,3,New Zealand,C Munro & GD Phillips
JEC Franklin, MJ Guptill,2009-2013,2009,2013,6,2,194,91,48.5,0,1,New Zealand,JEC Franklin & MJ Guptill
SP Fleming, BB McCullum,2005-2006,2005,2006,3,0,180,80,60,0,2,New Zealand,SP Fleming & BB McCullum
JEC Franklin, BB McCullum,2006-2013,2006,2013,6,0,177,94,29.5,0,1,New Zealand,JEC Franklin & BB McCullum
JEC Franklin, LRPL Taylor,2006-2012,2006,2012,10,0,161,40,16.1,0,0,New Zealand,JEC Franklin & LRPL Taylor
CD McMillan, JDP Oram,2007-2007,2007,2007,3,0,157,73,52.33,0,1,New Zealand,CD McMillan & JDP Oram
BB McCullum, AJ Redmond,2009-2010,2009,2010,6,0,155,51,25.83,0,1,New Zealand,BB McCullum & AJ Redmond
CJ Anderson, LRPL Taylor,2014-2018,2014,2018,10,1,153,34,17,0,0,New Zealand,CJ Anderson & LRPL Taylor
NL McCullum, DL Vettori,2009-2010,2009,2010,7,2,147,45,29.4,0,0,New Zealand,NL McCullum & DL Vettori
CD McMillan, SB Styris,2005-2007,2005,2007,5,0,136,60,27.2,0,1,New Zealand,CD McMillan & SB Styris
BB McCullum, SB Styris,2005-2009,2005,2009,4,0,130,66,32.5,0,1,New Zealand,BB McCullum & SB Styris
GD Phillips, KS Williamson,2017-2018,2017,2018,4,0,127,83,31.75,0,1,New Zealand,GD Phillips & KS Williamson
MJ Guptill, HD Rutherford,2013-2013,2013,2013,3,0,123,75,41,0,1,New Zealand,MJ Guptill & HD Rutherford
L Ronchi, LRPL Taylor,2014-2016,2014,2016,5,1,123,68,30.75,0,1,New Zealand,L Ronchi & LRPL Taylor
PG Fulton, BB McCullum,2006-2012,2006,2012,5,1,122,58,30.5,0,1,New Zealand,PG Fulton & BB McCullum
MS Chapman, MJ Guptill,2018-2018,2018,2018,2,0,121,64,60.5,0,2,New Zealand,MS Chapman & MJ Guptill
BB McCullum, JDP Oram,2005-2012,2005,2012,6,2,120,60*,30,0,1,New Zealand,BB McCullum & JDP Oram
BB McCullum, HD Rutherford,2013-2013,2013,2013,1,0,114,114,114,1,0,New Zealand,BB McCullum & HD Rutherford
C de Grandhomme, KS Williamson,2012-2018,2012,2018,5,2,111,81*,37,0,1,New Zealand,C de Grandhomme & KS Williamson
JEC Franklin, RJ Nicol,2012-2012,2012,2012,1,0,103,103,103,1,0,New Zealand,JEC Franklin & RJ Nicol
JDP Oram, SB Styris,2005-2009,2005,2009,4,0,100,34,25,0,0,New Zealand,JDP Oram & SB Styris
CJ Anderson, MJ Guptill,2014-2016,2014,2016,2,0,98,52,49,0,1,New Zealand,CJ Anderson & MJ Guptill
RJ Nicol, KS Williamson,2012-2012,2012,2012,3,0,96,53,32,0,1,New Zealand,RJ Nicol & KS Williamson
PJ Ingram, BB McCullum,2010-2010,2010,2010,3,1,91,79*,45.5,0,1,New Zealand,PJ Ingram & BB McCullum
MJ Guptill, JDP Oram,2009-2009,2009,2009,3,0,86,43,28.66,0,0,New Zealand,MJ Guptill & JDP Oram
BB McCullum, NL McCullum,2009-2012,2009,2012,3,2,86,50*,86,0,1,New Zealand,BB McCullum & NL McCullum
BB McCullum, L Ronchi,2014-2014,2014,2014,1,1,85,85*,-,0,1,New Zealand,BB McCullum & L Ronchi
MJ Guptill, GH Worker,2015-2015,2015,2015,2,0,83,49,41.5,0,0,New Zealand,MJ Guptill & GH Worker
CJ Anderson, L Ronchi,2014-2016,2014,2016,4,0,82,51,20.5,0,1,New Zealand,CJ Anderson & L Ronchi
JD Ryder, LRPL Taylor,2008-2011,2008,2011,6,0,82,25,13.66,0,0,New Zealand,JD Ryder & LRPL Taylor
RJ Nicol, LRPL Taylor,2010-2012,2010,2012,5,1,80,38,20,0,0,New Zealand,RJ Nicol & LRPL Taylor
NT Broom, BB McCullum,2009-2009,2009,2009,3,0,77,61,25.66,0,1,New Zealand,NT Broom & BB McCullum
GD Elliott, LRPL Taylor,2016-2016,2016,2016,4,2,77,22,38.5,0,0,New Zealand,GD Elliott & LRPL Taylor
MJ Guptill, SB Styris,2009-2010,2009,2010,4,0,77,61,19.25,0,1,New Zealand,MJ Guptill & SB Styris
AP Devcich, HD Rutherford,2013-2013,2013,2013,2,0,76,73,38,0,1,New Zealand,AP Devcich & HD Rutherford
JDS Neesham, L Ronchi,2014-2015,2014,2015,4,1,76,33,25.33,0,0,New Zealand,JDS Neesham & L Ronchi
GD Elliott, BB McCullum,2009-2013,2009,2013,2,0,73,58,36.5,0,1,New Zealand,GD Elliott & BB McCullum
PD McGlashan, LRPL Taylor,2010-2010,2010,2010,2,1,73,42,73,0,0,New Zealand,PD McGlashan & LRPL Taylor
PG Fulton, LRPL Taylor,2007-2007,2007,2007,2,0,72,70,36,0,1,New Zealand,PG Fulton & LRPL Taylor
MJ Santner, IS Sodhi,2017-2018,2017,2018,2,1,72,38*,72,0,0,New Zealand,MJ Santner & IS Sodhi
JEC Franklin, NL McCullum,2009-2013,2009,2013,7,1,69,39,11.5,0,0,New Zealand,JEC Franklin & NL McCullum
GJ Hopkins, BB McCullum,2010-2010,2010,2010,1,0,68,68,68,0,1,New Zealand,GJ Hopkins & BB McCullum
CJ Anderson, C Munro,2012-2017,2012,2017,6,0,65,24,10.83,0,0,New Zealand,CJ Anderson & C Munro
MJ Guptill, AJ Redmond,2009-2009,2009,2009,3,0,65,40,21.66,0,0,New Zealand,MJ Guptill & AJ Redmond
CJ Anderson, GD Elliott,2016-2016,2016,2016,2,0,64,64,32,0,1,New Zealand,CJ Anderson & GD Elliott
MS Chapman, KS Williamson,2018-2018,2018,2018,2,0,61,48,30.5,0,0,New Zealand,MS Chapman & KS Williamson
BB McCullum, RJ Nicol,2012-2012,2012,2012,3,0,61,42,20.33,0,0,New Zealand,BB McCullum & RJ Nicol
JDP Oram, JS Patel,2007-2008,2007,2008,2,0,61,33,30.5,0,0,New Zealand,JDP Oram & JS Patel
SB Styris, L Vincent,2006-2007,2006,2007,4,0,61,28,15.25,0,0,New Zealand,SB Styris & L Vincent
TC Bruce, KS Williamson,2017-2018,2017,2018,5,0,59,28,11.8,0,0,New Zealand,TC Bruce & KS Williamson
GD Elliott, MJ Guptill,2013-2015,2013,2015,2,0,59,34,29.5,0,0,New Zealand,GD Elliott & MJ Guptill
TWM Latham, LRPL Taylor,2013-2014,2013,2014,2,0,59,39,29.5,0,0,New Zealand,TWM Latham & LRPL Taylor
NL McCullum, L Ronchi,2013-2016,2013,2016,4,1,59,45,19.66,0,0,New Zealand,NL McCullum & L Ronchi
L Ronchi, GH Worker,2015-2015,2015,2015,2,0,56,49,28,0,0,New Zealand,L Ronchi & GH Worker
SB Styris, DL Vettori,2007-2010,2007,2010,3,0,56,40,18.66,0,0,New Zealand,SB Styris & DL Vettori
C de Grandhomme, LRPL Taylor,2018-2018,2018,2018,4,0,55,30,13.75,0,0,New Zealand,C de Grandhomme & LRPL Taylor
JEC Franklin, KS Williamson,2012-2012,2012,2012,2,0,55,45,27.5,0,0,New Zealand,JEC Franklin & KS Williamson
BB McCullum, C Munro,2012-2014,2012,2014,3,0,55,37,18.33,0,0,New Zealand,BB McCullum & C Munro
JDS Neesham, KS Williamson,2014-2017,2014,2017,4,0,54,34,13.5,0,0,New Zealand,JDS Neesham & KS Williamson
MJ Santner, BM Wheeler,2018-2018,2018,2018,1,0,54,54,54,0,1,New Zealand,MJ Santner & BM Wheeler
MJ Guptill, AK Kitchen,2018-2018,2018,2018,1,0,52,52,52,0,1,New Zealand,MJ Guptill & AK Kitchen
TWM Latham, L Ronchi,2014-2015,2014,2015,2,0,51,38,25.5,0,0,New Zealand,TWM Latham & L Ronchi
JEC Franklin, GJ Hopkins,2010-2010,2010,2010,1,0,50,50,50,0,1,New Zealand,JEC Franklin & GJ Hopkins
CJ Anderson, MJ Santner,2016-2016,2016,2016,2,1,49,28,49,0,0,New Zealand,CJ Anderson & MJ Santner
AP Devcich, KS Williamson,2014-2014,2014,2014,1,0,49,49,49,0,0,New Zealand,AP Devcich & KS Williamson
BB McCullum, DL Vettori,2012-2012,2012,2012,1,0,48,48,48,0,0,New Zealand,BB McCullum & DL Vettori
NL McCullum, C Munro,2012-2015,2012,2015,4,2,48,41*,24,0,0,New Zealand,NL McCullum & C Munro
CJ Anderson, BB McCullum,2014-2014,2014,2014,2,0,47,46,23.5,0,0,New Zealand,CJ Anderson & BB McCullum
C Munro, L Ronchi,2013-2015,2013,2015,3,0,46,31,15.33,0,0,New Zealand,C Munro & L Ronchi
NL McCullum, LRPL Taylor,2010-2014,2010,2014,5,0,45,14,9,0,0,New Zealand,NL McCullum & LRPL Taylor
JDP Oram, DL Vettori,2007-2010,2007,2010,4,0,45,20,11.25,0,0,New Zealand,JDP Oram & DL Vettori
PD McGlashan, SB Styris,2009-2010,2009,2010,2,0,43,25,21.5,0,0,New Zealand,PD McGlashan & SB Styris
DAJ Bracewell, RM Hira,2012-2012,2012,2012,2,0,42,21,21,0,0,New Zealand,DAJ Bracewell & RM Hira
TC Bruce, LRPL Taylor,2017-2018,2017,2018,2,0,41,39,20.5,0,0,New Zealand,TC Bruce & LRPL Taylor
MJ Santner, TG Southee,2017-2017,2017,2017,2,1,41,29*,41,0,0,New Zealand,MJ Santner & TG Southee
IS Sodhi, LRPL Taylor,2018-2018,2018,2018,2,0,41,38,20.5,0,0,New Zealand,IS Sodhi & LRPL Taylor
SB Styris, JW Wilson,2005-2005,2005,2005,1,0,40,40,40,0,0,New Zealand,SB Styris & JW Wilson
JM How, SB Styris,2007-2008,2007,2008,2,0,38,30,19,0,0,New Zealand,JM How & SB Styris
C Munro, JDS Neesham,2012-2015,2012,2015,2,0,38,20,19,0,0,New Zealand,C Munro & JDS Neesham
NJ Astle, SP Fleming,2005-2005,2005,2005,1,0,37,37,37,0,0,New Zealand,NJ Astle & SP Fleming
TWM Latham, KS Williamson,2017-2017,2017,2017,1,0,36,36,36,0,0,New Zealand,TWM Latham & KS Williamson
AP Devcich, TWM Latham,2013-2013,2013,2013,1,0,35,35,35,0,0,New Zealand,AP Devcich & TWM Latham
MR Gillespie, JDP Oram,2007-2007,2007,2007,1,0,35,35,35,0,0,New Zealand,MR Gillespie & JDP Oram
KD Mills, DL Vettori,2008-2010,2008,2010,5,2,35,20,11.66,0,0,New Zealand,KD Mills & DL Vettori
JDP Oram, TG Southee,2008-2012,2008,2012,2,1,35,23*,35,0,0,New Zealand,JDP Oram & TG Southee
GD Elliott, GH Worker,2015-2015,2015,2015,2,0,34,18,17,0,0,New Zealand,GD Elliott & GH Worker
GJ Hopkins, SB Styris,2007-2010,2007,2010,2,0,34,22,17,0,0,New Zealand,GJ Hopkins & SB Styris
TWM Latham, TG Southee,2012-2014,2012,2014,2,0,34,30,17,0,0,New Zealand,TWM Latham & TG Southee
GD Elliott, L Ronchi,2016-2016,2016,2016,2,0,32,16,16,0,0,New Zealand,GD Elliott & L Ronchi
TL Seifert, LRPL Taylor,2018-2018,2018,2018,4,1,32,15*,10.66,0,0,New Zealand,TL Seifert & LRPL Taylor
NJ Astle, L Vincent,2006-2006,2006,2006,1,0,31,31,31,0,0,New Zealand,NJ Astle & L Vincent
MR Gillespie, KD Mills,2007-2007,2007,2007,1,1,31,31*,-,0,0,New Zealand,MR Gillespie & KD Mills
MJ Santner, KS Williamson,2015-2016,2015,2016,2,0,31,30,15.5,0,0,New Zealand,MJ Santner & KS Williamson
NJ Astle, JEC Franklin,2006-2006,2006,2006,1,1,30,30*,-,0,0,New Zealand,NJ Astle & JEC Franklin
TD Astle, KS Williamson,2016-2016,2016,2016,1,0,30,30,30,0,0,New Zealand,TD Astle & KS Williamson
DR Flynn, LRPL Taylor,2008-2008,2008,2008,1,0,30,30,30,0,0,New Zealand,DR Flynn & LRPL Taylor
KD Mills, JDP Oram,2007-2008,2007,2008,2,0,30,20,15,0,0,New Zealand,KD Mills & JDP Oram
JD Ryder, KS Williamson,2012-2012,2012,2012,1,0,30,30,30,0,0,New Zealand,JD Ryder & KS Williamson
CJ Anderson, C de Grandhomme,2017-2017,2017,2017,1,1,29,29*,-,0,0,New Zealand,CJ Anderson & C de Grandhomme
CJ Anderson, NL McCullum,2012-2012,2012,2012,1,0,29,29,29,0,0,New Zealand,CJ Anderson & NL McCullum
TA Blundell, MJ Santner,2018-2018,2018,2018,1,1,29,29*,-,0,0,New Zealand,TA Blundell & MJ Santner
DAJ Bracewell, JDP Oram,2012-2012,2012,2012,1,0,29,29,29,0,0,New Zealand,DAJ Bracewell & JDP Oram
TC Bruce, TWM Latham,2017-2017,2017,2017,1,0,29,29,29,0,0,New Zealand,TC Bruce & TWM Latham
C de Grandhomme, MJ Santner,2017-2018,2017,2018,4,1,29,13*,9.66,0,0,New Zealand,C de Grandhomme & MJ Santner
AK Kitchen, LRPL Taylor,2017-2017,2017,2017,1,0,29,29,29,0,0,New Zealand,AK Kitchen & LRPL Taylor
KD Mills, SB Styris,2007-2010,2007,2010,2,0,29,15,14.5,0,0,New Zealand,KD Mills & SB Styris
MS Chapman, LRPL Taylor,2018-2018,2018,2018,4,0,28,12,7,0,0,New Zealand,MS Chapman & LRPL Taylor
DR Flynn, SB Styris,2008-2008,2008,2008,1,0,28,28,28,0,0,New Zealand,DR Flynn & SB Styris
JEC Franklin, C Munro,2012-2013,2012,2013,3,0,28,16,9.33,0,0,New Zealand,JEC Franklin & C Munro
PA Hitchcock, KD Mills,2008-2008,2008,2008,1,0,28,28,28,0,0,New Zealand,PA Hitchcock & KD Mills
JM How, JD Ryder,2008-2008,2008,2008,1,0,28,28,28,0,0,New Zealand,JM How & JD Ryder
NL McCullum, BJ Watling,2009-2009,2009,2009,1,0,28,28,28,0,0,New Zealand,NL McCullum & BJ Watling
TC Bruce, GD Phillips,2017-2017,2017,2017,1,0,27,27,27,0,0,New Zealand,TC Bruce & GD Phillips
MS Chapman, C de Grandhomme,2018-2018,2018,2018,2,1,27,19*,27,0,0,New Zealand,MS Chapman & C de Grandhomme
GD Elliott, MJ Santner,2016-2016,2016,2016,3,0,27,11,9,0,0,New Zealand,GD Elliott & MJ Santner
PG Fulton, SB Styris,2007-2008,2007,2008,3,0,27,15,9,0,0,New Zealand,PG Fulton & SB Styris
TA Blundell, LRPL Taylor,2018-2018,2018,2018,1,0,26,26,26,0,0,New Zealand,TA Blundell & LRPL Taylor
DAJ Bracewell, NL McCullum,2012-2015,2012,2015,4,1,26,24,8.66,0,0,New Zealand,DAJ Bracewell & NL McCullum
NT Broom, BJ Watling,2009-2009,2009,2009,1,0,26,26,26,0,0,New Zealand,NT Broom & BJ Watling
DR Flynn, TWM Latham,2012-2012,2012,2012,1,0,26,26,26,0,0,New Zealand,DR Flynn & TWM Latham
CD McMillan, DL Vettori,2007-2007,2007,2007,2,0,26,21,13,0,0,New Zealand,CD McMillan & DL Vettori
TG Southee, BM Wheeler,2017-2017,2017,2017,1,0,26,26,26,0,0,New Zealand,TG Southee & BM Wheeler
NJ Astle, PG Fulton,2006-2006,2006,2006,1,0,25,25,25,0,0,New Zealand,NJ Astle & PG Fulton
HM Nicholls, KS Williamson,2016-2016,2016,2016,1,0,25,25,25,0,0,New Zealand,HM Nicholls & KS Williamson
NJ Astle, LRPL Taylor,2006-2006,2006,2006,1,0,24,24,24,0,0,New Zealand,NJ Astle & LRPL Taylor
JEC Franklin, JDS Neesham,2012-2012,2012,2012,1,0,24,24,24,0,0,New Zealand,JEC Franklin & JDS Neesham
TG Southee, LRPL Taylor,2014-2018,2014,2018,4,1,24,14*,8,0,0,New Zealand,TG Southee & LRPL Taylor
CJ Anderson, TL Seifert,2018-2018,2018,2018,1,0,23,23,23,0,0,New Zealand,CJ Anderson & TL Seifert
AM Ellis, JDP Oram,2012-2012,2012,2012,1,0,23,23,23,0,0,New Zealand,AM Ellis & JDP Oram
MJ Guptill, TL Seifert,2018-2018,2018,2018,1,0,23,23,23,0,0,New Zealand,MJ Guptill & TL Seifert
JM How, LRPL Taylor,2008-2008,2008,2008,1,0,23,23,23,0,0,New Zealand,JM How & LRPL Taylor
NT Broom, KS Williamson,2017-2017,2017,2017,1,0,22,22,22,0,0,New Zealand,NT Broom & KS Williamson
TC Bruce, MJ Guptill,2018-2018,2018,2018,2,0,22,19,11,0,0,New Zealand,TC Bruce & MJ Guptill
C de Grandhomme, TG Southee,2018-2018,2018,2018,1,0,22,22,22,0,0,New Zealand,C de Grandhomme & TG Southee
AM Ellis, KS Williamson,2012-2012,2012,2012,1,1,22,22*,-,0,0,New Zealand,AM Ellis & KS Williamson
JEC Franklin, SB Styris,2009-2010,2009,2010,2,0,22,14,11,0,0,New Zealand,JEC Franklin & SB Styris
JM How, BB McCullum,2007-2008,2007,2008,2,0,22,21,11,0,0,New Zealand,JM How & BB McCullum
NL McCullum, JDP Oram,2010-2012,2010,2012,3,0,22,9,7.33,0,0,New Zealand,NL McCullum & JDP Oram
NL McCullum, TG Southee,2010-2015,2010,2015,4,1,22,13,7.33,0,0,New Zealand,NL McCullum & TG Southee
NL McCullum, SB Styris,2010-2010,2010,2010,1,0,22,22,22,0,0,New Zealand,NL McCullum & SB Styris
CD McMillan, LRPL Taylor,2007-2007,2007,2007,2,0,22,17,11,0,0,New Zealand,CD McMillan & LRPL Taylor
LRPL Taylor, L Vincent,2007-2007,2007,2007,3,0,22,11,7.33,0,0,New Zealand,LRPL Taylor & L Vincent
TA Boult, RM Hira,2013-2013,2013,2013,1,0,21,21,21,0,0,New Zealand,TA Boult & RM Hira
KD Mills, TG Southee,2008-2010,2008,2010,2,1,21,21*,21,0,0,New Zealand,KD Mills & TG Southee
JEC Franklin, KD Mills,2008-2008,2008,2008,1,0,20,20,20,0,0,New Zealand,JEC Franklin & KD Mills
JM How, L Vincent,2007-2007,2007,2007,1,0,20,20,20,0,0,New Zealand,JM How & L Vincent
TWM Latham, NL McCullum,2012-2015,2012,2015,2,0,20,16,10,0,0,New Zealand,TWM Latham & NL McCullum
BB McCullum, BJ Watling,2009-2009,2009,2009,1,0,20,20,20,0,0,New Zealand,BB McCullum & BJ Watling
NJ Astle, PD McGlashan,2006-2006,2006,2006,2,0,19,15,9.5,0,0,New Zealand,NJ Astle & PD McGlashan
SE Bond, JEC Franklin,2006-2006,2006,2006,1,1,19,19*,-,0,0,New Zealand,SE Bond & JEC Franklin
SE Bond, LRPL Taylor,2007-2007,2007,2007,1,0,19,19,19,0,0,New Zealand,SE Bond & LRPL Taylor
TC Bruce, JDS Neesham,2017-2017,2017,2017,1,0,19,19,19,0,0,New Zealand,TC Bruce & JDS Neesham
MR Gillespie, DL Vettori,2007-2007,2007,2007,1,0,19,19,19,0,0,New Zealand,MR Gillespie & DL Vettori
LRPL Taylor, BM Wheeler,2018-2018,2018,2018,1,1,19,19*,-,0,0,New Zealand,LRPL Taylor & BM Wheeler
CJ Anderson, JDS Neesham,2014-2014,2014,2014,1,1,18,18*,-,0,0,New Zealand,CJ Anderson & JDS Neesham
DG Brownlie, MJ Guptill,2010-2010,2010,2010,1,0,18,18,18,0,0,New Zealand,DG Brownlie & MJ Guptill
TC Bruce, C de Grandhomme,2017-2018,2017,2018,4,0,18,9,4.5,0,0,New Zealand,TC Bruce & C de Grandhomme
C de Grandhomme, BB McCullum,2012-2012,2012,2012,1,0,18,18,18,0,0,New Zealand,C de Grandhomme & BB McCullum
MJ Guptill, TWM Latham,2015-2015,2015,2015,1,0,18,18,18,0,0,New Zealand,MJ Guptill & TWM Latham
RM Hira, MJ McClenaghan,2013-2013,2013,2013,1,1,18,18*,-,0,0,New Zealand,RM Hira & MJ McClenaghan
KD Mills, KS Williamson,2014-2014,2014,2014,1,0,18,18,18,0,0,New Zealand,KD Mills & KS Williamson
CJ Anderson, TC Bruce,2017-2017,2017,2017,1,0,17,17,17,0,0,New Zealand,CJ Anderson & TC Bruce
C de Grandhomme, MJ Guptill,2012-2012,2012,2012,2,1,17,9,17,0,0,New Zealand,C de Grandhomme & MJ Guptill
GD Elliott, KS Williamson,2016-2016,2016,2016,1,0,17,17,17,0,0,New Zealand,GD Elliott & KS Williamson
PG Fulton, L Vincent,2006-2007,2006,2007,3,0,17,9,5.66,0,0,New Zealand,PG Fulton & L Vincent
MJ Guptill, DL Vettori,2010-2010,2010,2010,1,0,17,17,17,0,0,New Zealand,MJ Guptill & DL Vettori
CS Martin, JDP Oram,2008-2008,2008,2008,1,0,17,17,17,0,0,New Zealand,CS Martin & JDP Oram
JS Patel, LRPL Taylor,2007-2007,2007,2007,1,1,17,17*,-,0,0,New Zealand,JS Patel & LRPL Taylor
GD Phillips, MJ Santner,2018-2018,2018,2018,1,1,17,17*,-,0,0,New Zealand,GD Phillips & MJ Santner
AR Adams, SB Styris,2005-2005,2005,2005,1,0,16,16,16,0,0,New Zealand,AR Adams & SB Styris
JEC Franklin, JD Ryder,2012-2012,2012,2012,1,0,16,16,16,0,0,New Zealand,JEC Franklin & JD Ryder
NL McCullum, AF Milne,2014-2015,2014,2015,2,2,16,11*,-,0,0,New Zealand,NL McCullum & AF Milne
C de Grandhomme, GD Phillips,2017-2018,2017,2018,3,0,15,9,5,0,0,New Zealand,C de Grandhomme & GD Phillips
DR Flynn, KD Mills,2008-2008,2008,2008,2,0,15,8,7.5,0,0,New Zealand,DR Flynn & KD Mills
MR Gillespie, CD McMillan,2007-2007,2007,2007,2,1,15,14*,15,0,0,New Zealand,MR Gillespie & CD McMillan
DAJ Bracewell, MJ McClenaghan,2012-2012,2012,2012,2,1,14,9*,14,0,0,New Zealand,DAJ Bracewell & MJ McClenaghan
DAJ Bracewell, LRPL Taylor,2012-2012,2012,2012,1,0,14,14,14,0,0,New Zealand,DAJ Bracewell & LRPL Taylor
SP Fleming, L Vincent,2006-2006,2006,2006,1,0,14,14,14,0,0,New Zealand,SP Fleming & L Vincent
JEC Franklin, JDP Oram,2008-2010,2008,2010,2,0,14,9,7,0,0,New Zealand,JEC Franklin & JDP Oram
MJ Henry, KS Williamson,2016-2016,2016,2016,1,0,14,14,14,0,0,New Zealand,MJ Henry & KS Williamson
LRPL Taylor, DL Vettori,2007-2010,2007,2010,4,0,14,6,3.5,0,0,New Zealand,LRPL Taylor & DL Vettori
GJ Hopkins, NL McCullum,2010-2010,2010,2010,1,0,13,13,13,0,0,New Zealand,GJ Hopkins & NL McCullum
AK Kitchen, C Munro,2018-2018,2018,2018,1,0,13,13,13,0,0,New Zealand,AK Kitchen & C Munro
TWM Latham, C Munro,2013-2013,2013,2013,1,0,13,13,13,0,0,New Zealand,TWM Latham & C Munro
BB McCullum, JAH Marshall,2008-2008,2008,2008,1,0,13,13,13,0,0,New Zealand,BB McCullum & JAH Marshall
C de Grandhomme, BM Wheeler,2017-2017,2017,2017,1,0,12,12,12,0,0,New Zealand,C de Grandhomme & BM Wheeler
GD Elliott, NL McCullum,2009-2009,2009,2009,1,1,12,12*,-,0,0,New Zealand,GD Elliott & NL McCullum
GJ Hopkins, DL Vettori,2010-2010,2010,2010,3,0,12,6,4,0,0,New Zealand,GJ Hopkins & DL Vettori
NL McCullum, JDS Neesham,2012-2015,2012,2015,3,0,12,9,4,0,0,New Zealand,NL McCullum & JDS Neesham
RJ Nicol, TG Southee,2012-2012,2012,2012,2,0,12,12,6,0,0,New Zealand,RJ Nicol & TG Southee
L Ronchi, MJ Santner,2016-2016,2016,2016,1,0,12,12,12,0,0,New Zealand,L Ronchi & MJ Santner
L Ronchi, KS Williamson,2014-2017,2014,2017,4,0,12,6,3,0,0,New Zealand,L Ronchi & KS Williamson
NT Broom, AP Devcich,2013-2013,2013,2013,1,0,11,11,11,0,0,New Zealand,NT Broom & AP Devcich
C de Grandhomme, HM Nicholls,2017-2017,2017,2017,1,0,11,11,11,0,0,New Zealand,C de Grandhomme & HM Nicholls
AM Ellis, NL McCullum,2012-2013,2012,2013,3,0,11,6,3.66,0,0,New Zealand,AM Ellis & NL McCullum
MJ Guptill, PJ Ingram,2010-2010,2010,2010,1,0,11,11,11,0,0,New Zealand,MJ Guptill & PJ Ingram
AP Devcich, LRPL Taylor,2013-2013,2013,2013,1,0,10,10,10,0,0,New Zealand,AP Devcich & LRPL Taylor
DR Flynn, JDP Oram,2008-2008,2008,2008,1,0,10,10,10,0,0,New Zealand,DR Flynn & JDP Oram
JEC Franklin, DL Vettori,2008-2010,2008,2010,3,0,10,5,3.33,0,0,New Zealand,JEC Franklin & DL Vettori
MJ Guptill, PD McGlashan,2009-2009,2009,2009,2,0,10,8,5,0,0,New Zealand,MJ Guptill & PD McGlashan
TWM Latham, HM Nicholls,2017-2017,2017,2017,1,0,10,10,10,0,0,New Zealand,TWM Latham & HM Nicholls
HJH Marshall, SB Styris,2005-2005,2005,2005,1,0,10,10,10,0,0,New Zealand,HJH Marshall & SB Styris
TA Boult, KS Williamson,2014-2014,2014,2014,1,0,9,9,9,0,0,New Zealand,TA Boult & KS Williamson
DAJ Bracewell, AF Milne,2015-2015,2015,2015,1,1,9,9*,-,0,0,New Zealand,DAJ Bracewell & AF Milne
NT Broom, KD Mills,2009-2009,2009,2009,1,0,9,9,9,0,0,New Zealand,NT Broom & KD Mills
NT Broom, LRPL Taylor,2009-2009,2009,2009,1,0,9,9,9,0,0,New Zealand,NT Broom & LRPL Taylor
IG Butler, JEC Franklin,2013-2013,2013,2013,1,0,9,9,9,0,0,New Zealand,IG Butler & JEC Franklin
IG Butler, NL McCullum,2009-2010,2009,2010,2,1,9,6*,9,0,0,New Zealand,IG Butler & NL McCullum
AP Devcich, MJ Guptill,2014-2014,2014,2014,1,0,9,9,9,0,0,New Zealand,AP Devcich & MJ Guptill
GD Elliott, JDS Neesham,2015-2015,2015,2015,1,0,9,9,9,0,0,New Zealand,GD Elliott & JDS Neesham
PG Fulton, RJ Nicol,2012-2012,2012,2012,1,0,9,9,9,0,0,New Zealand,PG Fulton & RJ Nicol
SE Bond, NL McCullum,2009-2009,2009,2009,1,0,8,8,8,0,0,New Zealand,SE Bond & NL McCullum
IG Butler, KD Mills,2009-2009,2009,2009,1,0,8,8,8,0,0,New Zealand,IG Butler & KD Mills
KD Mills, JDS Neesham,2014-2014,2014,2014,1,1,8,8*,-,0,0,New Zealand,KD Mills & JDS Neesham
SE Bond, DL Vettori,2007-2007,2007,2007,1,0,7,7,7,0,0,New Zealand,SE Bond & DL Vettori
TA Boult, TG Southee,2014-2017,2014,2017,2,0,7,6,3.5,0,0,New Zealand,TA Boult & TG Southee
CL Cairns, L Vincent,2006-2006,2006,2006,1,0,7,7,7,0,0,New Zealand,CL Cairns & L Vincent
DR Flynn, JM How,2008-2008,2008,2008,1,0,7,7,7,0,0,New Zealand,DR Flynn & JM How
PG Fulton, JM How,2008-2008,2008,2008,1,0,7,7,7,0,0,New Zealand,PG Fulton & JM How
NL McCullum, KD Mills,2010-2012,2010,2012,3,0,7,4,2.33,0,0,New Zealand,NL McCullum & KD Mills
KD Mills, AF Milne,2010-2012,2010,2012,2,1,7,7,7,0,0,New Zealand,KD Mills & AF Milne
SHA Rance, IS Sodhi,2018-2018,2018,2018,2,0,7,6,3.5,0,0,New Zealand,SHA Rance & IS Sodhi
TG Southee, KS Williamson,2012-2012,2012,2012,1,0,7,7,7,0,0,New Zealand,TG Southee & KS Williamson
SB Styris, BJ Watling,2009-2009,2009,2009,1,0,7,7,7,0,0,New Zealand,SB Styris & BJ Watling
AR Adams, PD McGlashan,2006-2006,2006,2006,1,0,6,6,6,0,0,New Zealand,AR Adams & PD McGlashan
TA Blundell, TC Bruce,2018-2018,2018,2018,1,0,6,6,6,0,0,New Zealand,TA Blundell & TC Bruce
SE Bond, CD McMillan,2007-2007,2007,2007,2,0,6,4,3,0,0,New Zealand,SE Bond & CD McMillan
SE Bond, TG Southee,2009-2009,2009,2009,1,0,6,6,6,0,0,New Zealand,SE Bond & TG Southee
DAJ Bracewell, C Munro,2012-2012,2012,2012,1,0,6,6,6,0,0,New Zealand,DAJ Bracewell & C Munro
IG Butler, DL Vettori,2009-2009,2009,2009,1,0,6,6,6,0,0,New Zealand,IG Butler & DL Vettori
GD Elliott, JEC Franklin,2009-2009,2009,2009,1,0,6,6,6,0,0,New Zealand,GD Elliott & JEC Franklin
LH Ferguson, IS Sodhi,2018-2018,2018,2018,1,0,6,6,6,0,0,New Zealand,LH Ferguson & IS Sodhi
